{
  "primary_source": "Kipf & Welling 2017, Semi-Supervised Classification with Graph Convolutional Networks, ICLR; arxiv:1609.02907.",
  "schema_version": "QA_ML_ORBIT_TOPOLOGY_CERT.v1",
  "fixture_kind": "pass",
  "modulus": 9,
  "train_fraction": 0.30,
  "n_seeds": 20,
  "epochs": 300,
  "hidden": 32,
  "n_satellite": 8,
  "n_pairs": 81,
  "raw_mlp_macro_f1_mean": 0.439,
  "qa_full_logreg_macro_f1_mean": 0.573,
  "with_graph_macro_f1_mean": 1.000,
  "without_graph_macro_f1_mean": 0.696,
  "graph_delta": 0.304,
  "passes_threshold": true,
  "tolerance": 0.001
}
